{
  "id": 12463,
  "name": null,
  "sponsor": "HOTEL EASTMAN",
  "event": "BREAKFAST",
  "venue": "COMMERCIAL",
  "place": "HOT SPRINGS, AR",
  "physical_description": "CARD; 5.5X8.5;",
  "occasion": "DAILY",
  "notes": null,
  "call_number": "1900-2099_0345",
  "keywords": null,
  "language": null,
  "date": "1900-04-15",
  "location": "Hotel Eastman",
  "location_type": null,
  "currency": "Dollars",
  "currency_symbol": "$",
  "status": "complete",
  "page_count": 2,
  "dish_count": 67
}
